No.     Time           Source                Destination           Protocol Length Info
     95 5.531760       81.161.59.87          192.168.1.154         HTTP     333    HTTP/1.1 200 OK  (application/json)

Frame 95: 333 bytes on wire (2664 bits), 333 bytes captured (2664 bits) on interface 0
Ethernet II, Src: AsustekC_f2:51:d8 (e0:3f:49:f2:51:d8), Dst: IntelCor_60:1e:36 (70:1c:e7:60:1e:36)
Internet Protocol Version 4, Src: 81.161.59.87, Dst: 192.168.1.154
Transmission Control Protocol, Src Port: 80, Dst Port: 54590, Seq: 1, Ack: 1, Len: 279
Hypertext Transfer Protocol
    HTTP/1.1 200 OK\r\n
        [Expert Info (Chat/Sequence): HTTP/1.1 200 OK\r\n]
        Response Version: HTTP/1.1
        Status Code: 200
        [Status Code Description: OK]
        Response Phrase: OK
    Content-Type: application/json; charset=utf-8\r\n
    Content-Length: 16\r\n
    Access-Control-Allow-Origin: *\r\n
    Access-Control-Allow-Methods: GET,POST\r\n
    Access-Control-Allow-Headers: Content-Type\r\n
    Connection: Keep-Alive\r\n
    Date: Sat, 29 Sep 2018 00:32:38 GMT\r\n
    \r\n
    [HTTP response 1/2]
    [Next request in frame: 96]
    File Data: 16 bytes
JavaScript Object Notation: application/json

No.     Time           Source                Destination           Protocol Length Info
     96 5.532621       192.168.1.154         81.161.59.87          HTTP     149    GET /poll?push_id=7412f270-e941-44de-a5de-dc87ff5dc488 HTTP/1.1 

Frame 96: 149 bytes on wire (1192 bits), 149 bytes captured (1192 bits) on interface 0
Ethernet II, Src: IntelCor_60:1e:36 (70:1c:e7:60:1e:36), Dst: AsustekC_f2:51:d8 (e0:3f:49:f2:51:d8)
Internet Protocol Version 4, Src: 192.168.1.154, Dst: 81.161.59.87
Transmission Control Protocol, Src Port: 54590, Dst Port: 80, Seq: 1, Ack: 280, Len: 95
Hypertext Transfer Protocol
    GET /poll?push_id=7412f270-e941-44de-a5de-dc87ff5dc488 HTTP/1.1\r\n
        [Expert Info (Chat/Sequence): GET /poll?push_id=7412f270-e941-44de-a5de-dc87ff5dc488 HTTP/1.1\r\n]
        Request Method: GET
        Request URI: /poll?push_id=7412f270-e941-44de-a5de-dc87ff5dc488
        Request Version: HTTP/1.1
    Host: push.bitdefender.net\r\n
    \r\n
    [Full request URI: http://push.bitdefender.net/poll?push_id=7412f270-e941-44de-a5de-dc87ff5dc488]
    [HTTP request 2/2]

No.     Time           Source                Destination           Protocol Length Info
    106 6.775600       81.161.59.85          192.168.1.154         HTTP     333    HTTP/1.1 200 OK  (application/json)

Frame 106: 333 bytes on wire (2664 bits), 333 bytes captured (2664 bits) on interface 0
Ethernet II, Src: AsustekC_f2:51:d8 (e0:3f:49:f2:51:d8), Dst: IntelCor_60:1e:36 (70:1c:e7:60:1e:36)
Internet Protocol Version 4, Src: 81.161.59.85, Dst: 192.168.1.154
Transmission Control Protocol, Src Port: 80, Dst Port: 54437, Seq: 1, Ack: 1, Len: 279
Hypertext Transfer Protocol
    HTTP/1.1 200 OK\r\n
        [Expert Info (Chat/Sequence): HTTP/1.1 200 OK\r\n]
        Response Version: HTTP/1.1
        Status Code: 200
        [Status Code Description: OK]
        Response Phrase: OK
    Content-Type: application/json; charset=utf-8\r\n
    Content-Length: 16\r\n
    Access-Control-Allow-Origin: *\r\n
    Access-Control-Allow-Methods: GET,POST\r\n
    Access-Control-Allow-Headers: Content-Type\r\n
    Connection: Keep-Alive\r\n
    Date: Sat, 29 Sep 2018 00:32:40 GMT\r\n
    \r\n
    [HTTP response 1/2]
    [Next request in frame: 107]
    File Data: 16 bytes
JavaScript Object Notation: application/json

No.     Time           Source                Destination           Protocol Length Info
    107 6.775805       192.168.1.154         81.161.59.85          HTTP     149    GET /poll?push_id=d277e8a1-41f0-4b73-b11b-5803f5b83f87 HTTP/1.1 

Frame 107: 149 bytes on wire (1192 bits), 149 bytes captured (1192 bits) on interface 0
Ethernet II, Src: IntelCor_60:1e:36 (70:1c:e7:60:1e:36), Dst: AsustekC_f2:51:d8 (e0:3f:49:f2:51:d8)
Internet Protocol Version 4, Src: 192.168.1.154, Dst: 81.161.59.85
Transmission Control Protocol, Src Port: 54437, Dst Port: 80, Seq: 1, Ack: 280, Len: 95
Hypertext Transfer Protocol
    GET /poll?push_id=d277e8a1-41f0-4b73-b11b-5803f5b83f87 HTTP/1.1\r\n
        [Expert Info (Chat/Sequence): GET /poll?push_id=d277e8a1-41f0-4b73-b11b-5803f5b83f87 HTTP/1.1\r\n]
        Request Method: GET
        Request URI: /poll?push_id=d277e8a1-41f0-4b73-b11b-5803f5b83f87
        Request Version: HTTP/1.1
    Host: push.bitdefender.net\r\n
    \r\n
    [Full request URI: http://push.bitdefender.net/poll?push_id=d277e8a1-41f0-4b73-b11b-5803f5b83f87]
    [HTTP request 2/2]
