No.     Time           Source                Destination           Protocol Length Info
    185 1.500726       192.168.1.154         54.243.128.120        HTTP     596    GET /client_cgi/unblocking_rate?rmt_ver=1.108.99&ext_ver=1.108.99&browser=chrome&product=cws&lccgi=1&src_country=ca&limit=200 HTTP/1.1 

Frame 185: 596 bytes on wire (4768 bits), 596 bytes captured (4768 bits) on interface 0
Ethernet II, Src: IntelCor_60:1e:36 (70:1c:e7:60:1e:36), Dst: AsustekC_f2:51:d8 (e0:3f:49:f2:51:d8)
Internet Protocol Version 4, Src: 192.168.1.154, Dst: 54.243.128.120
Transmission Control Protocol, Src Port: 61920, Dst Port: 80, Seq: 1, Ack: 1, Len: 542
Hypertext Transfer Protocol
    GET /client_cgi/unblocking_rate?rmt_ver=1.108.99&ext_ver=1.108.99&browser=chrome&product=cws&lccgi=1&src_country=ca&limit=200 HTTP/1.1\r\n
        [Expert Info (Chat/Sequence): GET /client_cgi/unblocking_rate?rmt_ver=1.108.99&ext_ver=1.108.99&browser=chrome&product=cws&lccgi=1&src_country=ca&limit=200 HTTP/1.1\r\n]
        Request Method: GET
        Request URI: /client_cgi/unblocking_rate?rmt_ver=1.108.99&ext_ver=1.108.99&browser=chrome&product=cws&lccgi=1&src_country=ca&limit=200
        Request Version: HTTP/1.1
    Host: client.hola.org\r\n
    Connection: keep-alive\r\n
    Accept: application/json, text/javascript, */*; q=0.01\r\n
    User-Agent: Mozilla/5.0 (Windows NT 10.0; Win64; x64) AppleWebKit/537.36 (KHTML, like Gecko) Chrome/69.0.3497.100 Safari/537.36\r\n
    Accept-Encoding: gzip, deflate\r\n
    Accept-Language: en-GB,en-US;q=0.9,en;q=0.8\r\n
    Cookie: uuid=87fa114e13977a1e76ec9b2b37724603\r\n
    If-None-Match: W/"1a1c-Vrp7PunWX1A2JzEQxNrMdQ"\r\n
    \r\n
    [Full request URI: http://client.hola.org/client_cgi/unblocking_rate?rmt_ver=1.108.99&ext_ver=1.108.99&browser=chrome&product=cws&lccgi=1&src_country=ca&limit=200]
    [HTTP request 1/1]
    [Response in frame: 194]

No.     Time           Source                Destination           Protocol Length Info
    194 1.550760       54.243.128.120        192.168.1.154         HTTP     1170   HTTP/1.1 200 OK  (application/json)

Frame 194: 1170 bytes on wire (9360 bits), 1170 bytes captured (9360 bits) on interface 0
Ethernet II, Src: AsustekC_f2:51:d8 (e0:3f:49:f2:51:d8), Dst: IntelCor_60:1e:36 (70:1c:e7:60:1e:36)
Internet Protocol Version 4, Src: 54.243.128.120, Dst: 192.168.1.154
Transmission Control Protocol, Src Port: 80, Dst Port: 61920, Seq: 5841, Ack: 543, Len: 1116
[5 Reassembled TCP Segments (6956 bytes): #189(1460), #190(1460), #192(1460), #193(1460), #194(1116)]
Hypertext Transfer Protocol
    HTTP/1.1 200 OK\r\n
        [Expert Info (Chat/Sequence): HTTP/1.1 200 OK\r\n]
        Response Version: HTTP/1.1
        Status Code: 200
        [Status Code Description: OK]
        Response Phrase: OK
    Server: nginx/1.10.1\r\n
    Date: Fri, 28 Sep 2018 23:46:21 GMT\r\n
    Content-Type: application/json; charset=utf-8\r\n
    Content-Length: 6688\r\n
    Connection: keep-alive\r\n
    X-Powered-By: Express\r\n
    Cache-Control: public,max-age=300\r\n
    ETag: W/"1a20-TzB6XwTTt8wXgWfXQbKVng"\r\n
    \r\n
    [HTTP response 1/1]
    [Time since request: 0.050034000 seconds]
    [Request in frame: 185]
    File Data: 6688 bytes
JavaScript Object Notation: application/json
