No.     Time           Source                Destination           Protocol Length Info
      2 0.271679       192.168.1.154         192.168.1.227         TCP      171    50025 → 8009 [PSH, ACK] Seq=1 Ack=1 Win=256 Len=117 [TCP segment of a reassembled PDU]

Frame 2: 171 bytes on wire (1368 bits), 171 bytes captured (1368 bits) on interface 0
Ethernet II, Src: IntelCor_60:1e:36 (70:1c:e7:60:1e:36), Dst: Google_8d:94:4a (48:d6:d5:8d:94:4a)
Internet Protocol Version 4, Src: 192.168.1.154, Dst: 192.168.1.227
Transmission Control Protocol, Src Port: 50025, Dst Port: 8009, Seq: 1, Ack: 1, Len: 117

No.     Time           Source                Destination           Protocol Length Info
      3 0.274541       192.168.1.227         192.168.1.154         TCP      171    8009 → 50025 [PSH, ACK] Seq=1 Ack=118 Win=279 Len=117 [TCP segment of a reassembled PDU]

Frame 3: 171 bytes on wire (1368 bits), 171 bytes captured (1368 bits) on interface 0
Ethernet II, Src: Google_8d:94:4a (48:d6:d5:8d:94:4a), Dst: IntelCor_60:1e:36 (70:1c:e7:60:1e:36)
Internet Protocol Version 4, Src: 192.168.1.227, Dst: 192.168.1.154
Transmission Control Protocol, Src Port: 8009, Dst Port: 50025, Seq: 1, Ack: 118, Len: 117

No.     Time           Source                Destination           Protocol Length Info
      4 0.313914       192.168.1.154         192.168.1.227         TCP      54     50025 → 8009 [ACK] Seq=118 Ack=118 Win=255 Len=0

Frame 4: 54 bytes on wire (432 bits), 54 bytes captured (432 bits) on interface 0
Ethernet II, Src: IntelCor_60:1e:36 (70:1c:e7:60:1e:36), Dst: Google_8d:94:4a (48:d6:d5:8d:94:4a)
Internet Protocol Version 4, Src: 192.168.1.154, Dst: 192.168.1.227
Transmission Control Protocol, Src Port: 50025, Dst Port: 8009, Seq: 118, Ack: 118, Len: 0

No.     Time           Source                Destination           Protocol Length Info
      5 0.736833       34.235.83.12          192.168.1.154         TCP      54     443 → 55556 [FIN, ACK] Seq=1 Ack=1 Win=119 Len=0

Frame 5: 54 bytes on wire (432 bits), 54 bytes captured (432 bits) on interface 0
Ethernet II, Src: AsustekC_f2:51:d8 (e0:3f:49:f2:51:d8), Dst: IntelCor_60:1e:36 (70:1c:e7:60:1e:36)
Internet Protocol Version 4, Src: 34.235.83.12, Dst: 192.168.1.154
Transmission Control Protocol, Src Port: 443, Dst Port: 55556, Seq: 1, Ack: 1, Len: 0

No.     Time           Source                Destination           Protocol Length Info
      6 0.736964       192.168.1.154         34.235.83.12          TCP      54     55556 → 443 [ACK] Seq=1 Ack=2 Win=67 Len=0

Frame 6: 54 bytes on wire (432 bits), 54 bytes captured (432 bits) on interface 0
Ethernet II, Src: IntelCor_60:1e:36 (70:1c:e7:60:1e:36), Dst: AsustekC_f2:51:d8 (e0:3f:49:f2:51:d8)
Internet Protocol Version 4, Src: 192.168.1.154, Dst: 34.235.83.12
Transmission Control Protocol, Src Port: 55556, Dst Port: 443, Seq: 1, Ack: 2, Len: 0

No.     Time           Source                Destination           Protocol Length Info
      7 0.792359       31.13.80.8            192.168.1.154         TLSv1.2  136    Application Data

Frame 7: 136 bytes on wire (1088 bits), 136 bytes captured (1088 bits) on interface 0
Ethernet II, Src: AsustekC_f2:51:d8 (e0:3f:49:f2:51:d8), Dst: IntelCor_60:1e:36 (70:1c:e7:60:1e:36)
Internet Protocol Version 4, Src: 31.13.80.8, Dst: 192.168.1.154
Transmission Control Protocol, Src Port: 443, Dst Port: 54461, Seq: 1, Ack: 1, Len: 82
Secure Sockets Layer

No.     Time           Source                Destination           Protocol Length Info
      8 0.833494       192.168.1.154         31.13.80.8            TCP      54     54461 → 443 [ACK] Seq=1 Ack=83 Win=65 Len=0

Frame 8: 54 bytes on wire (432 bits), 54 bytes captured (432 bits) on interface 0
Ethernet II, Src: IntelCor_60:1e:36 (70:1c:e7:60:1e:36), Dst: AsustekC_f2:51:d8 (e0:3f:49:f2:51:d8)
Internet Protocol Version 4, Src: 192.168.1.154, Dst: 31.13.80.8
Transmission Control Protocol, Src Port: 54461, Dst Port: 443, Seq: 1, Ack: 83, Len: 0

No.     Time           Source                Destination           Protocol Length Info
      9 0.850033       192.168.1.154         128.119.245.12        TCP      66     56392 → 80 [SYN] Seq=0 Win=17520 Len=0 MSS=1460 WS=256 SACK_PERM=1

Frame 9: 66 bytes on wire (528 bits), 66 bytes captured (528 bits) on interface 0
Ethernet II, Src: IntelCor_60:1e:36 (70:1c:e7:60:1e:36), Dst: AsustekC_f2:51:d8 (e0:3f:49:f2:51:d8)
Internet Protocol Version 4, Src: 192.168.1.154, Dst: 128.119.245.12
Transmission Control Protocol, Src Port: 56392, Dst Port: 80, Seq: 0, Len: 0

No.     Time           Source                Destination           Protocol Length Info
     10 0.850279       192.168.1.154         128.119.245.12        TCP      66     56393 → 80 [SYN] Seq=0 Win=17520 Len=0 MSS=1460 WS=256 SACK_PERM=1

Frame 10: 66 bytes on wire (528 bits), 66 bytes captured (528 bits) on interface 0
Ethernet II, Src: IntelCor_60:1e:36 (70:1c:e7:60:1e:36), Dst: AsustekC_f2:51:d8 (e0:3f:49:f2:51:d8)
Internet Protocol Version 4, Src: 192.168.1.154, Dst: 128.119.245.12
Transmission Control Protocol, Src Port: 56393, Dst Port: 80, Seq: 0, Len: 0

No.     Time           Source                Destination           Protocol Length Info
     11 0.884719       128.119.245.12        192.168.1.154         TCP      66     80 → 56392 [SYN, ACK] Seq=0 Ack=1 Win=29200 Len=0 MSS=1460 SACK_PERM=1 WS=128

Frame 11: 66 bytes on wire (528 bits), 66 bytes captured (528 bits) on interface 0
Ethernet II, Src: AsustekC_f2:51:d8 (e0:3f:49:f2:51:d8), Dst: IntelCor_60:1e:36 (70:1c:e7:60:1e:36)
Internet Protocol Version 4, Src: 128.119.245.12, Dst: 192.168.1.154
Transmission Control Protocol, Src Port: 80, Dst Port: 56392, Seq: 0, Ack: 1, Len: 0

No.     Time           Source                Destination           Protocol Length Info
     12 0.884900       192.168.1.154         128.119.245.12        TCP      54     56392 → 80 [ACK] Seq=1 Ack=1 Win=17408 Len=0

Frame 12: 54 bytes on wire (432 bits), 54 bytes captured (432 bits) on interface 0
Ethernet II, Src: IntelCor_60:1e:36 (70:1c:e7:60:1e:36), Dst: AsustekC_f2:51:d8 (e0:3f:49:f2:51:d8)
Internet Protocol Version 4, Src: 192.168.1.154, Dst: 128.119.245.12
Transmission Control Protocol, Src Port: 56392, Dst Port: 80, Seq: 1, Ack: 1, Len: 0

No.     Time           Source                Destination           Protocol Length Info
     13 0.885028       128.119.245.12        192.168.1.154         TCP      66     80 → 56393 [SYN, ACK] Seq=0 Ack=1 Win=29200 Len=0 MSS=1460 SACK_PERM=1 WS=128

Frame 13: 66 bytes on wire (528 bits), 66 bytes captured (528 bits) on interface 0
Ethernet II, Src: AsustekC_f2:51:d8 (e0:3f:49:f2:51:d8), Dst: IntelCor_60:1e:36 (70:1c:e7:60:1e:36)
Internet Protocol Version 4, Src: 128.119.245.12, Dst: 192.168.1.154
Transmission Control Protocol, Src Port: 80, Dst Port: 56393, Seq: 0, Ack: 1, Len: 0

No.     Time           Source                Destination           Protocol Length Info
     14 0.885078       192.168.1.154         128.119.245.12        TCP      54     56393 → 80 [ACK] Seq=1 Ack=1 Win=17408 Len=0

Frame 14: 54 bytes on wire (432 bits), 54 bytes captured (432 bits) on interface 0
Ethernet II, Src: IntelCor_60:1e:36 (70:1c:e7:60:1e:36), Dst: AsustekC_f2:51:d8 (e0:3f:49:f2:51:d8)
Internet Protocol Version 4, Src: 192.168.1.154, Dst: 128.119.245.12
Transmission Control Protocol, Src Port: 56393, Dst Port: 80, Seq: 1, Ack: 1, Len: 0

No.     Time           Source                Destination           Protocol Length Info
     17 0.920455       192.168.1.154         54.243.128.120        TCP      66     56394 → 80 [SYN] Seq=0 Win=17520 Len=0 MSS=1460 WS=256 SACK_PERM=1

Frame 17: 66 bytes on wire (528 bits), 66 bytes captured (528 bits) on interface 0
Ethernet II, Src: IntelCor_60:1e:36 (70:1c:e7:60:1e:36), Dst: AsustekC_f2:51:d8 (e0:3f:49:f2:51:d8)
Internet Protocol Version 4, Src: 192.168.1.154, Dst: 54.243.128.120
Transmission Control Protocol, Src Port: 56394, Dst Port: 80, Seq: 0, Len: 0

No.     Time           Source                Destination           Protocol Length Info
     18 0.968228       54.243.128.120        192.168.1.154         TCP      66     80 → 56394 [SYN, ACK] Seq=0 Ack=1 Win=26883 Len=0 MSS=1460 SACK_PERM=1 WS=128

Frame 18: 66 bytes on wire (528 bits), 66 bytes captured (528 bits) on interface 0
Ethernet II, Src: AsustekC_f2:51:d8 (e0:3f:49:f2:51:d8), Dst: IntelCor_60:1e:36 (70:1c:e7:60:1e:36)
Internet Protocol Version 4, Src: 54.243.128.120, Dst: 192.168.1.154
Transmission Control Protocol, Src Port: 80, Dst Port: 56394, Seq: 0, Ack: 1, Len: 0

No.     Time           Source                Destination           Protocol Length Info
     19 0.968328       192.168.1.154         54.243.128.120        TCP      54     56394 → 80 [ACK] Seq=1 Ack=1 Win=17408 Len=0

Frame 19: 54 bytes on wire (432 bits), 54 bytes captured (432 bits) on interface 0
Ethernet II, Src: IntelCor_60:1e:36 (70:1c:e7:60:1e:36), Dst: AsustekC_f2:51:d8 (e0:3f:49:f2:51:d8)
Internet Protocol Version 4, Src: 192.168.1.154, Dst: 54.243.128.120
Transmission Control Protocol, Src Port: 56394, Dst Port: 80, Seq: 1, Ack: 1, Len: 0

No.     Time           Source                Destination           Protocol Length Info
     20 0.969013       192.168.1.154         54.243.128.120        HTTP     596    GET /client_cgi/unblocking_rate?rmt_ver=1.108.99&ext_ver=1.108.99&browser=chrome&product=cws&lccgi=1&src_country=ca&limit=200 HTTP/1.1 

Frame 20: 596 bytes on wire (4768 bits), 596 bytes captured (4768 bits) on interface 0
Ethernet II, Src: IntelCor_60:1e:36 (70:1c:e7:60:1e:36), Dst: AsustekC_f2:51:d8 (e0:3f:49:f2:51:d8)
Internet Protocol Version 4, Src: 192.168.1.154, Dst: 54.243.128.120
Transmission Control Protocol, Src Port: 56394, Dst Port: 80, Seq: 1, Ack: 1, Len: 542
Hypertext Transfer Protocol
    GET /client_cgi/unblocking_rate?rmt_ver=1.108.99&ext_ver=1.108.99&browser=chrome&product=cws&lccgi=1&src_country=ca&limit=200 HTTP/1.1\r\n
    Host: client.hola.org\r\n
    Connection: keep-alive\r\n
    Accept: application/json, text/javascript, */*; q=0.01\r\n
    User-Agent: Mozilla/5.0 (Windows NT 10.0; Win64; x64) AppleWebKit/537.36 (KHTML, like Gecko) Chrome/69.0.3497.100 Safari/537.36\r\n
    Accept-Encoding: gzip, deflate\r\n
    Accept-Language: en-GB,en-US;q=0.9,en;q=0.8\r\n
    Cookie: uuid=87fa114e13977a1e76ec9b2b37724603\r\n
    If-None-Match: W/"19d6-YA+2m8gPDsqySx+zt0kPQw"\r\n
    \r\n
    [Full request URI: http://client.hola.org/client_cgi/unblocking_rate?rmt_ver=1.108.99&ext_ver=1.108.99&browser=chrome&product=cws&lccgi=1&src_country=ca&limit=200]
    [HTTP request 1/1]
    [Response in frame: 28]

No.     Time           Source                Destination           Protocol Length Info
     22 1.017640       54.243.128.120        192.168.1.154         TCP      60     80 → 56394 [ACK] Seq=1 Ack=543 Win=28032 Len=0

Frame 22: 60 bytes on wire (480 bits), 60 bytes captured (480 bits) on interface 0
Ethernet II, Src: AsustekC_f2:51:d8 (e0:3f:49:f2:51:d8), Dst: IntelCor_60:1e:36 (70:1c:e7:60:1e:36)
Internet Protocol Version 4, Src: 54.243.128.120, Dst: 192.168.1.154
Transmission Control Protocol, Src Port: 80, Dst Port: 56394, Seq: 1, Ack: 543, Len: 0

No.     Time           Source                Destination           Protocol Length Info
     23 1.017641       54.243.128.120        192.168.1.154         TCP      1514   80 → 56394 [ACK] Seq=1 Ack=543 Win=28032 Len=1460 [TCP segment of a reassembled PDU]

Frame 23: 1514 bytes on wire (12112 bits), 1514 bytes captured (12112 bits) on interface 0
Ethernet II, Src: AsustekC_f2:51:d8 (e0:3f:49:f2:51:d8), Dst: IntelCor_60:1e:36 (70:1c:e7:60:1e:36)
Internet Protocol Version 4, Src: 54.243.128.120, Dst: 192.168.1.154
Transmission Control Protocol, Src Port: 80, Dst Port: 56394, Seq: 1, Ack: 543, Len: 1460

No.     Time           Source                Destination           Protocol Length Info
     24 1.017641       54.243.128.120        192.168.1.154         TCP      1514   80 → 56394 [ACK] Seq=1461 Ack=543 Win=28032 Len=1460 [TCP segment of a reassembled PDU]

Frame 24: 1514 bytes on wire (12112 bits), 1514 bytes captured (12112 bits) on interface 0
Ethernet II, Src: AsustekC_f2:51:d8 (e0:3f:49:f2:51:d8), Dst: IntelCor_60:1e:36 (70:1c:e7:60:1e:36)
Internet Protocol Version 4, Src: 54.243.128.120, Dst: 192.168.1.154
Transmission Control Protocol, Src Port: 80, Dst Port: 56394, Seq: 1461, Ack: 543, Len: 1460

No.     Time           Source                Destination           Protocol Length Info
     25 1.017643       54.243.128.120        192.168.1.154         TCP      1514   80 → 56394 [ACK] Seq=2921 Ack=543 Win=28032 Len=1460 [TCP segment of a reassembled PDU]

Frame 25: 1514 bytes on wire (12112 bits), 1514 bytes captured (12112 bits) on interface 0
Ethernet II, Src: AsustekC_f2:51:d8 (e0:3f:49:f2:51:d8), Dst: IntelCor_60:1e:36 (70:1c:e7:60:1e:36)
Internet Protocol Version 4, Src: 54.243.128.120, Dst: 192.168.1.154
Transmission Control Protocol, Src Port: 80, Dst Port: 56394, Seq: 2921, Ack: 543, Len: 1460

No.     Time           Source                Destination           Protocol Length Info
     26 1.017745       192.168.1.154         54.243.128.120        TCP      54     56394 → 80 [ACK] Seq=543 Ack=4381 Win=17408 Len=0

Frame 26: 54 bytes on wire (432 bits), 54 bytes captured (432 bits) on interface 0
Ethernet II, Src: IntelCor_60:1e:36 (70:1c:e7:60:1e:36), Dst: AsustekC_f2:51:d8 (e0:3f:49:f2:51:d8)
Internet Protocol Version 4, Src: 192.168.1.154, Dst: 54.243.128.120
Transmission Control Protocol, Src Port: 56394, Dst Port: 80, Seq: 543, Ack: 4381, Len: 0

No.     Time           Source                Destination           Protocol Length Info
     27 1.018226       54.243.128.120        192.168.1.154         TCP      1514   80 → 56394 [ACK] Seq=4381 Ack=543 Win=28032 Len=1460 [TCP segment of a reassembled PDU]

Frame 27: 1514 bytes on wire (12112 bits), 1514 bytes captured (12112 bits) on interface 0
Ethernet II, Src: AsustekC_f2:51:d8 (e0:3f:49:f2:51:d8), Dst: IntelCor_60:1e:36 (70:1c:e7:60:1e:36)
Internet Protocol Version 4, Src: 54.243.128.120, Dst: 192.168.1.154
Transmission Control Protocol, Src Port: 80, Dst Port: 56394, Seq: 4381, Ack: 543, Len: 1460

No.     Time           Source                Destination           Protocol Length Info
     28 1.018226       54.243.128.120        192.168.1.154         HTTP     1097   HTTP/1.1 200 OK  (application/json)

Frame 28: 1097 bytes on wire (8776 bits), 1097 bytes captured (8776 bits) on interface 0
Ethernet II, Src: AsustekC_f2:51:d8 (e0:3f:49:f2:51:d8), Dst: IntelCor_60:1e:36 (70:1c:e7:60:1e:36)
Internet Protocol Version 4, Src: 54.243.128.120, Dst: 192.168.1.154
Transmission Control Protocol, Src Port: 80, Dst Port: 56394, Seq: 5841, Ack: 543, Len: 1043
[5 Reassembled TCP Segments (6883 bytes): #23(1460), #24(1460), #25(1460), #27(1460), #28(1043)]
Hypertext Transfer Protocol
    HTTP/1.1 200 OK\r\n
    Server: nginx/1.10.1\r\n
    Date: Sat, 29 Sep 2018 01:12:08 GMT\r\n
    Content-Type: application/json; charset=utf-8\r\n
    Content-Length: 6615\r\n
    Connection: keep-alive\r\n
    X-Powered-By: Express\r\n
    Cache-Control: public,max-age=300\r\n
    ETag: W/"19d7-Z+nxKv8zAk6+8iWCevaUlQ"\r\n
    \r\n
    [HTTP response 1/1]
    [Time since request: 0.049213000 seconds]
    [Request in frame: 20]
    File Data: 6615 bytes
JavaScript Object Notation: application/json

No.     Time           Source                Destination           Protocol Length Info
     29 1.018288       192.168.1.154         54.243.128.120        TCP      54     56394 → 80 [ACK] Seq=543 Ack=6884 Win=17408 Len=0

Frame 29: 54 bytes on wire (432 bits), 54 bytes captured (432 bits) on interface 0
Ethernet II, Src: IntelCor_60:1e:36 (70:1c:e7:60:1e:36), Dst: AsustekC_f2:51:d8 (e0:3f:49:f2:51:d8)
Internet Protocol Version 4, Src: 192.168.1.154, Dst: 54.243.128.120
Transmission Control Protocol, Src Port: 56394, Dst Port: 80, Seq: 543, Ack: 6884, Len: 0

No.     Time           Source                Destination           Protocol Length Info
     30 1.304385       192.168.1.154         192.168.1.63          TCP      171    50020 → 8009 [PSH, ACK] Seq=1 Ack=1 Win=256 Len=117 [TCP segment of a reassembled PDU]

Frame 30: 171 bytes on wire (1368 bits), 171 bytes captured (1368 bits) on interface 0
Ethernet II, Src: IntelCor_60:1e:36 (70:1c:e7:60:1e:36), Dst: Google_eb:71:92 (7c:2e:bd:eb:71:92)
Internet Protocol Version 4, Src: 192.168.1.154, Dst: 192.168.1.63
Transmission Control Protocol, Src Port: 50020, Dst Port: 8009, Seq: 1, Ack: 1, Len: 117

No.     Time           Source                Destination           Protocol Length Info
     31 1.310469       192.168.1.63          192.168.1.154         TCP      171    8009 → 50020 [PSH, ACK] Seq=1 Ack=118 Win=279 Len=117 [TCP segment of a reassembled PDU]

Frame 31: 171 bytes on wire (1368 bits), 171 bytes captured (1368 bits) on interface 0
Ethernet II, Src: Google_eb:71:92 (7c:2e:bd:eb:71:92), Dst: IntelCor_60:1e:36 (70:1c:e7:60:1e:36)
Internet Protocol Version 4, Src: 192.168.1.63, Dst: 192.168.1.154
Transmission Control Protocol, Src Port: 8009, Dst Port: 50020, Seq: 1, Ack: 118, Len: 117

No.     Time           Source                Destination           Protocol Length Info
     32 1.351125       192.168.1.154         192.168.1.63          TCP      54     50020 → 8009 [ACK] Seq=118 Ack=118 Win=255 Len=0

Frame 32: 54 bytes on wire (432 bits), 54 bytes captured (432 bits) on interface 0
Ethernet II, Src: IntelCor_60:1e:36 (70:1c:e7:60:1e:36), Dst: Google_eb:71:92 (7c:2e:bd:eb:71:92)
Internet Protocol Version 4, Src: 192.168.1.154, Dst: 192.168.1.63
Transmission Control Protocol, Src Port: 50020, Dst Port: 8009, Seq: 118, Ack: 118, Len: 0

No.     Time           Source                Destination           Protocol Length Info
     33 1.523634       81.161.59.96          192.168.1.154         TCP      60     80 → 54660 [ACK] Seq=1 Ack=1 Win=1 Len=0

Frame 33: 60 bytes on wire (480 bits), 60 bytes captured (480 bits) on interface 0
Ethernet II, Src: AsustekC_f2:51:d8 (e0:3f:49:f2:51:d8), Dst: IntelCor_60:1e:36 (70:1c:e7:60:1e:36)
Internet Protocol Version 4, Src: 81.161.59.96, Dst: 192.168.1.154
Transmission Control Protocol, Src Port: 80, Dst Port: 54660, Seq: 1, Ack: 1, Len: 0

No.     Time           Source                Destination           Protocol Length Info
     34 1.523678       192.168.1.154         81.161.59.96          TCP      54     [TCP ACKed unseen segment] 54660 → 80 [ACK] Seq=1 Ack=2 Win=65 Len=0

Frame 34: 54 bytes on wire (432 bits), 54 bytes captured (432 bits) on interface 0
Ethernet II, Src: IntelCor_60:1e:36 (70:1c:e7:60:1e:36), Dst: AsustekC_f2:51:d8 (e0:3f:49:f2:51:d8)
Internet Protocol Version 4, Src: 192.168.1.154, Dst: 81.161.59.96
Transmission Control Protocol, Src Port: 54660, Dst Port: 80, Seq: 1, Ack: 2, Len: 0

No.     Time           Source                Destination           Protocol Length Info
     35 1.897678       192.168.1.154         192.168.1.42          TCP      171    50026 → 8009 [PSH, ACK] Seq=1 Ack=1 Win=256 Len=117 [TCP segment of a reassembled PDU]

Frame 35: 171 bytes on wire (1368 bits), 171 bytes captured (1368 bits) on interface 0
Ethernet II, Src: IntelCor_60:1e:36 (70:1c:e7:60:1e:36), Dst: Google_8b:3d:26 (48:d6:d5:8b:3d:26)
Internet Protocol Version 4, Src: 192.168.1.154, Dst: 192.168.1.42
Transmission Control Protocol, Src Port: 50026, Dst Port: 8009, Seq: 1, Ack: 1, Len: 117

No.     Time           Source                Destination           Protocol Length Info
     36 1.899827       192.168.1.42          192.168.1.154         TCP      171    8009 → 50026 [PSH, ACK] Seq=1 Ack=118 Win=279 Len=117 [TCP segment of a reassembled PDU]

Frame 36: 171 bytes on wire (1368 bits), 171 bytes captured (1368 bits) on interface 0
Ethernet II, Src: Google_8b:3d:26 (48:d6:d5:8b:3d:26), Dst: IntelCor_60:1e:36 (70:1c:e7:60:1e:36)
Internet Protocol Version 4, Src: 192.168.1.42, Dst: 192.168.1.154
Transmission Control Protocol, Src Port: 8009, Dst Port: 50026, Seq: 1, Ack: 118, Len: 117

No.     Time           Source                Destination           Protocol Length Info
     37 1.940866       192.168.1.154         192.168.1.42          TCP      54     50026 → 8009 [ACK] Seq=118 Ack=118 Win=255 Len=0

Frame 37: 54 bytes on wire (432 bits), 54 bytes captured (432 bits) on interface 0
Ethernet II, Src: IntelCor_60:1e:36 (70:1c:e7:60:1e:36), Dst: Google_8b:3d:26 (48:d6:d5:8b:3d:26)
Internet Protocol Version 4, Src: 192.168.1.154, Dst: 192.168.1.42
Transmission Control Protocol, Src Port: 50026, Dst Port: 8009, Seq: 118, Ack: 118, Len: 0
