No.     Time           Source                Destination           Protocol Length Info
     40 1.710261       10.204.51.30          128.119.245.12        HTTP     492    GET /wireshark-labs/HTTP-wireshark-file1.html HTTP/1.1 

Frame 40: 492 bytes on wire (3936 bits), 492 bytes captured (3936 bits) on interface 0
Ethernet II, Src: IntelCor_60:1e:36 (70:1c:e7:60:1e:36), Dst: ArubaNet_01:5d:d0 (00:1a:1e:01:5d:d0)
Internet Protocol Version 4, Src: 10.204.51.30, Dst: 128.119.245.12
Transmission Control Protocol, Src Port: 65432, Dst Port: 80, Seq: 1, Ack: 1, Len: 438
Hypertext Transfer Protocol
    GET /wireshark-labs/HTTP-wireshark-file1.html HTTP/1.1\r\n
    Host: gaia.cs.umass.edu\r\n
    Connection: keep-alive\r\n
    Upgrade-Insecure-Requests: 1\r\n
    User-Agent: Mozilla/5.0 (Windows NT 10.0; Win64; x64) AppleWebKit/537.36 (KHTML, like Gecko) Chrome/69.0.3497.100 Safari/537.36\r\n
    Accept: text/html,application/xhtml+xml,application/xml;q=0.9,image/webp,image/apng,*/*;q=0.8\r\n
    Accept-Encoding: gzip, deflate\r\n
    Accept-Language: en-GB,en-US;q=0.9,en;q=0.8\r\n
    \r\n
    [Full request URI: http://gaia.cs.umass.edu/wireshark-labs/HTTP-wireshark-file1.html]
    [HTTP request 1/1]
    [Response in frame: 42]

No.     Time           Source                Destination           Protocol Length Info
     42 1.747390       128.119.245.12        10.204.51.30          HTTP     540    HTTP/1.1 200 OK  (text/html)

Frame 42: 540 bytes on wire (4320 bits), 540 bytes captured (4320 bits) on interface 0
Ethernet II, Src: ArubaNet_01:5d:d0 (00:1a:1e:01:5d:d0), Dst: IntelCor_60:1e:36 (70:1c:e7:60:1e:36)
Internet Protocol Version 4, Src: 128.119.245.12, Dst: 10.204.51.30
Transmission Control Protocol, Src Port: 80, Dst Port: 65432, Seq: 1, Ack: 439, Len: 486
Hypertext Transfer Protocol
    HTTP/1.1 200 OK\r\n
    Date: Tue, 02 Oct 2018 17:36:27 GMT\r\n
    Server: Apache/2.4.6 (CentOS) OpenSSL/1.0.2k-fips PHP/5.4.16 mod_perl/2.0.10 Perl/v5.16.3\r\n
    Last-Modified: Tue, 02 Oct 2018 05:59:02 GMT\r\n
    ETag: "80-577389e5a7acb"\r\n
    Accept-Ranges: bytes\r\n
    Content-Length: 128\r\n
    Keep-Alive: timeout=5, max=100\r\n
    Connection: Keep-Alive\r\n
    Content-Type: text/html; charset=UTF-8\r\n
    \r\n
    [HTTP response 1/1]
    [Time since request: 0.037129000 seconds]
    [Request in frame: 40]
    File Data: 128 bytes
Line-based text data: text/html (4 lines)
